{"$schema":"https://json-schema.org/draft/2020-12/schema","$id":"https://trustedrouter.com/providers/marketplace/catalog.v2.schema.json","title":"TrustedRouter provider reliability contract v2","description":"Canonical models, pricing, lifecycle, regional capacity, deadlines, and machine-readable overload semantics for TrustedRouter providers.","type":"object","additionalProperties":false,"required":["object","contract_version","provider","data"],"properties":{"object":{"const":"list"},"data":{"type":"array","items":{"$ref":"#/$defs/model"}},"contract_version":{"const":"2.0"},"provider":{"type":"object","additionalProperties":false,"required":["id","status_url","support_contact","incident_contact","regions","request_id_header","error_contract"],"properties":{"id":{"type":"string","pattern":"^[a-z0-9][a-z0-9._-]*$"},"status_url":{"type":"string","format":"uri"},"support_contact":{"type":"string","format":"uri"},"incident_contact":{"type":"string","format":"uri"},"regions":{"type":"array","minItems":1,"uniqueItems":true,"items":{"type":"string","minLength":1}},"request_id_header":{"type":"string","pattern":"^[A-Za-z0-9-]+$"},"error_contract":{"type":"object","additionalProperties":false,"required":["rate_limit_status","overload_status","retry_after_header","account_quota_error_codes"],"properties":{"rate_limit_status":{"const":429},"overload_status":{"const":503},"retry_after_header":{"const":"Retry-After"},"account_quota_error_codes":{"type":"array","uniqueItems":true,"items":{"type":"string","minLength":1}}}}}}},"$defs":{"model":{"type":"object","additionalProperties":false,"required":["id","object","owned_by","name","type","context_length","max_output_tokens","endpoints","input_modalities","output_modalities","capabilities","pricing","lifecycle","reliability"],"properties":{"id":{"type":"string","pattern":"^[a-z0-9][a-z0-9._-]*/[a-z0-9][a-z0-9._/-]*$"},"object":{"const":"model"},"owned_by":{"type":"string","pattern":"^[a-z0-9][a-z0-9._-]*$"},"name":{"type":"string","minLength":1},"type":{"const":"chat"},"context_length":{"type":"integer","minimum":1},"max_output_tokens":{"type":"integer","minimum":1},"endpoints":{"type":"array","minItems":1,"uniqueItems":true,"items":{"enum":["chat/completions","responses"]}},"input_modalities":{"type":"array","minItems":1,"uniqueItems":true,"items":{"enum":["text","image","audio","video","file"]}},"output_modalities":{"type":"array","minItems":1,"uniqueItems":true,"items":{"enum":["text","image","audio"]}},"capabilities":{"type":"object","additionalProperties":false,"required":["streaming","tools","structured_output","reasoning","prompt_caching"],"properties":{"streaming":{"type":"boolean"},"tools":{"type":"boolean"},"structured_output":{"type":"boolean"},"reasoning":{"type":"boolean"},"prompt_caching":{"type":"boolean"},"receipts":{"type":"object","additionalProperties":false,"required":["spec","algorithms","delivery"],"properties":{"spec":{"const":"inference-receipt/1"},"algorithms":{"type":"array","minItems":1,"uniqueItems":true,"items":{"enum":["EdDSA"]}},"delivery":{"type":"array","minItems":1,"uniqueItems":true,"items":{"enum":["header","stream-chunk"]}}}}}},"pricing":{"type":"object","additionalProperties":false,"required":["currency","unit","input","output","cached_input","cache_write","minimum_request"],"properties":{"currency":{"const":"USD"},"unit":{"const":"per_1m_tokens"},"input":{"type":"string","pattern":"^(0|[1-9][0-9]*)(\\.[0-9]+)?$"},"output":{"type":"string","pattern":"^(0|[1-9][0-9]*)(\\.[0-9]+)?$"},"cached_input":{"type":["string","null"],"pattern":"^(0|[1-9][0-9]*)(\\.[0-9]+)?$"},"cache_write":{"type":["string","null"],"pattern":"^(0|[1-9][0-9]*)(\\.[0-9]+)?$"},"minimum_request":{"type":"string","pattern":"^(0|[1-9][0-9]*)(\\.[0-9]+)?$"}}},"lifecycle":{"type":"object","additionalProperties":false,"required":["status","deprecation_at","retirement_at","replacement_model_id"],"properties":{"status":{"enum":["active","deprecated","retired"]},"deprecation_at":{"type":["string","null"],"format":"date-time"},"retirement_at":{"type":["string","null"],"format":"date-time"},"replacement_model_id":{"type":["string","null"],"pattern":"^[a-z0-9][a-z0-9._-]*/[a-z0-9][a-z0-9._/-]*$"}}},"documentation":{"type":"object","additionalProperties":false,"required":["description","input_format","output_format","example_input","example_output"],"properties":{"description":{"type":"string","minLength":1,"maxLength":1000},"input_format":{"type":"string","minLength":1,"maxLength":2000},"output_format":{"type":"string","minLength":1,"maxLength":2000},"example_input":{"type":"string","minLength":1,"maxLength":8192},"example_output":{"type":"string","minLength":1,"maxLength":8192}}},"reliability":{"type":"object","additionalProperties":false,"required":["first_token_timeout_seconds","completion_timeout_seconds","stream_idle_timeout_seconds","capacity_scope"],"properties":{"first_token_timeout_seconds":{"type":"number","exclusiveMinimum":0,"maximum":300},"completion_timeout_seconds":{"type":"number","exclusiveMinimum":0,"maximum":900},"stream_idle_timeout_seconds":{"type":"number","exclusiveMinimum":0,"maximum":300},"capacity_scope":{"enum":["global","region","model","model_region"]}}}}}}}